<?xml version="1.0" encoding="UTF-8"?>
<xs:schema xmlns:xs="http://www.w3.org/2001/XMLSchema"
           targetNamespace="https://rolitoansu.github.io/xml/sitio-personal"
           xmlns="https://rolitoansu.github.io/xml/sitio-personal"
           elementFormDefault="qualified"
           attributeFormDefault="unqualified">

  <!-- ======================================================== -->
  <!-- TIPOS SIMPLES Y RESTRICCIONES                          -->
  <!-- ======================================================== -->

  <xs:simpleType name="TipoIdioma">
    <xs:restriction base="xs:string">
      <xs:pattern value="[a-z]{2}(-[A-Z]{2})?"/>
    </xs:restriction>
  </xs:simpleType>

  <xs:simpleType name="TipoEmail">
    <xs:restriction base="xs:string">
      <xs:pattern value="[a-zA-Z0-9._%+-]+@[a-zA-Z0-9.-]+\.[a-zA-Z]{2,}"/>
    </xs:restriction>
  </xs:simpleType>

  <xs:simpleType name="TipoNivelHabilidad">
    <xs:restriction base="xs:string">
      <xs:enumeration value="Básico"/>
      <xs:enumeration value="Intermedio"/>
      <xs:enumeration value="Avanzado"/>
      <xs:enumeration value="Experto"/>
    </xs:restriction>
  </xs:simpleType>

  <xs:simpleType name="TipoPorcentaje">
    <xs:restriction base="xs:integer">
      <xs:minInclusive value="0"/>
      <xs:maxInclusive value="100"/>
    </xs:restriction>
  </xs:simpleType>

  <xs:simpleType name="TipoNivelCompetencia">
    <xs:union memberTypes="TipoPorcentaje xs:string"/>
  </xs:simpleType>

  <xs:simpleType name="TipoEstadoProyecto">
    <xs:restriction base="xs:string">
      <xs:enumeration value="completado"/>
      <xs:enumeration value="en-progreso"/>
      <xs:enumeration value="mantenimiento"/>
      <xs:enumeration value="planificado"/>
    </xs:restriction>
  </xs:simpleType>

  <xs:simpleType name="TipoAvatar">
    <xs:annotation>
      <xs:documentation>
        Estilos predefinidos de avatar vectorial o referencia directa al recurso SVG:
        - generico: Avatar profesional neutro en SVG.
        - desarrollador: Avatar de perfil técnico / software con estética dev.
        - disenador: Avatar de perfil creativo y diseño UX/UI.
        - personalizado: Utiliza la imagen local o remota del atributo src.
        También admite los nombres de fichero SVG correspondientes.
      </xs:documentation>
    </xs:annotation>
    <xs:restriction base="xs:string">
      <xs:enumeration value="generico"/>
      <xs:enumeration value="desarrollador"/>
      <xs:enumeration value="disenador"/>
      <xs:enumeration value="personalizado"/>
      <xs:enumeration value="avatar-generico.svg"/>
      <xs:enumeration value="avatar-desarrollador.svg"/>
      <xs:enumeration value="avatar-disenador.svg"/>
    </xs:restriction>
  </xs:simpleType>

  <!-- ======================================================== -->
  <!-- ELEMENTO RAÍZ: SITIO-PERSONAL                            -->
  <!-- ======================================================== -->

  <xs:element name="sitio-personal">
    <xs:complexType>
      <xs:sequence>
        <xs:element name="metadatos" type="TipoMetadatos"/>
        <xs:element name="paginas" type="TipoPaginas"/>
      </xs:sequence>
      <xs:attribute name="idioma" type="TipoIdioma" default="es"/>
      <xs:attribute name="version" type="xs:string" default="1.0"/>
      <xs:attribute name="id" type="xs:ID" use="optional"/>
    </xs:complexType>
  </xs:element>

  <!-- ======================================================== -->
  <!-- METADATOS Y AUTOR                                        -->
  <!-- ======================================================== -->

  <xs:complexType name="TipoMetadatos">
    <xs:sequence>
      <xs:element name="autor" type="TipoAutor"/>
      <xs:element name="contacto-info" type="TipoContactoInfo"/>
      <xs:element name="redes-sociales" type="TipoRedesSociales" minOccurs="0"/>
    </xs:sequence>
  </xs:complexType>

  <xs:complexType name="TipoAutor">
    <xs:sequence>
      <xs:element name="nombre-completo" type="xs:string"/>
      <xs:element name="nombre" type="xs:string"/>
      <xs:element name="apellidos" type="xs:string"/>
      <xs:element name="titular" type="xs:string"/>
      <xs:element name="lema" type="xs:string" minOccurs="0"/>
      <xs:element name="descripcion" type="xs:string"/>
      <xs:element name="palabras-clave" type="xs:string"/>
      <xs:element name="foto" type="TipoFotoAutor"/>
    </xs:sequence>
  </xs:complexType>

  <xs:complexType name="TipoFotoAutor">
    <xs:attribute name="src" type="xs:string" use="optional" default="assets/img/avatar-generico.svg"/>
    <xs:attribute name="alt" type="xs:string" use="required"/>
    <xs:attribute name="ancho" type="xs:positiveInteger" use="optional" default="208"/>
    <xs:attribute name="alto" type="xs:positiveInteger" use="optional" default="208"/>
    <xs:attribute name="avatar" type="TipoAvatar" use="optional" default="generico"/>
  </xs:complexType>

  <xs:complexType name="TipoImagen">
    <xs:attribute name="src" type="xs:string" use="required"/>
    <xs:attribute name="alt" type="xs:string" use="required"/>
    <xs:attribute name="ancho" type="xs:positiveInteger" use="optional"/>
    <xs:attribute name="alto" type="xs:positiveInteger" use="optional"/>
    <xs:attribute name="avatar" type="TipoAvatar" use="optional"/>
  </xs:complexType>

  <xs:complexType name="TipoContactoInfo">
    <xs:sequence>
      <xs:element name="email" type="TipoEmail"/>
      <xs:element name="ubicacion" type="xs:string"/>
      <xs:element name="empresa" type="xs:string" minOccurs="0"/>
      <xs:element name="telefono" type="xs:string" minOccurs="0"/>
      <xs:element name="disponibilidad" type="xs:string" minOccurs="0"/>
    </xs:sequence>
  </xs:complexType>

  <xs:complexType name="TipoRedesSociales">
    <xs:sequence>
      <xs:element name="red" type="TipoRed" maxOccurs="unbounded"/>
    </xs:sequence>
  </xs:complexType>

  <xs:complexType name="TipoRed">
    <xs:attribute name="tipo" type="xs:string" use="required"/>
    <xs:attribute name="url" type="xs:anyURI" use="required"/>
    <xs:attribute name="usuario" type="xs:string" use="required"/>
    <xs:attribute name="etiqueta" type="xs:string" use="optional"/>
  </xs:complexType>

  <!-- ======================================================== -->
  <!-- CONTENEDOR DE PÁGINAS                                   -->
  <!-- ======================================================== -->

  <xs:complexType name="TipoPaginas">
    <xs:sequence>
      <xs:element name="inicio" type="TipoPaginaInicio"/>
      <xs:element name="sobre-mi" type="TipoPaginaSobreMi"/>
      <xs:element name="proyectos" type="TipoPaginaProyectos"/>
      <xs:element name="curriculum" type="TipoPaginaCurriculum"/>
      <xs:element name="contacto" type="TipoPaginaContacto"/>
    </xs:sequence>
  </xs:complexType>

  <!-- ======================================================== -->
  <!-- 1. PÁGINA DE INICIO                                      -->
  <!-- ======================================================== -->

  <xs:complexType name="TipoPaginaInicio">
    <xs:sequence>
      <xs:element name="hero" type="TipoHero"/>
      <xs:element name="datos-rapidos" type="TipoDatosRapidos" minOccurs="0"/>
      <xs:element name="tecnologias-destacadas" type="TipoTecnologiasDestacadas"/>
    </xs:sequence>
  </xs:complexType>

  <xs:complexType name="TipoHero">
    <xs:sequence>
      <xs:element name="saludo" type="xs:string"/>
      <xs:element name="subtitulo" type="xs:string"/>
      <xs:element name="resumen" type="xs:string"/>
      <xs:element name="acciones" type="TipoAccionesHero"/>
    </xs:sequence>
  </xs:complexType>

  <xs:complexType name="TipoAccionesHero">
    <xs:sequence>
      <xs:element name="accion" type="TipoAccionHero" maxOccurs="unbounded"/>
    </xs:sequence>
  </xs:complexType>

  <xs:complexType name="TipoAccionHero">
    <xs:attribute name="texto" type="xs:string" use="required"/>
    <xs:attribute name="href" type="xs:string" use="required"/>
    <xs:attribute name="tipo" default="secundario">
      <xs:simpleType>
        <xs:restriction base="xs:string">
          <xs:enumeration value="primario"/>
          <xs:enumeration value="secundario"/>
        </xs:restriction>
      </xs:simpleType>
    </xs:attribute>
  </xs:complexType>

  <xs:complexType name="TipoDatosRapidos">
    <xs:sequence>
      <xs:element name="metrica" maxOccurs="unbounded">
        <xs:complexType>
          <xs:attribute name="valor" type="xs:string" use="required"/>
          <xs:attribute name="etiqueta" type="xs:string" use="required"/>
        </xs:complexType>
      </xs:element>
    </xs:sequence>
  </xs:complexType>

  <xs:complexType name="TipoTecnologiasDestacadas">
    <xs:sequence>
      <xs:element name="titulo" type="xs:string" default="Tecnologías"/>
      <xs:element name="descripcion" type="xs:string"/>
      <xs:element name="tecnologia" type="TipoTecnologia" maxOccurs="unbounded"/>
    </xs:sequence>
  </xs:complexType>

  <xs:complexType name="TipoTecnologia">
    <xs:sequence>
      <xs:element name="nombre" type="xs:string"/>
      <xs:element name="nivel" type="TipoNivelHabilidad"/>
      <xs:element name="icono" minOccurs="0">
        <xs:complexType>
          <xs:attribute name="src" type="xs:string" use="required"/>
        </xs:complexType>
      </xs:element>
    </xs:sequence>
    <xs:attribute name="categoria" type="xs:string" use="optional"/>
  </xs:complexType>

  <!-- ======================================================== -->
  <!-- 2. PÁGINA SOBRE MÍ                                       -->
  <!-- ======================================================== -->

  <xs:complexType name="TipoPaginaSobreMi">
    <xs:sequence>
      <xs:element name="cabecera" type="TipoCabeceraPagina"/>
      <xs:element name="trayectoria" type="TipoTrayectoria"/>
      <xs:element name="datos-personales" type="TipoDatosPersonalesTabla"/>
      <xs:element name="intereses" type="TipoIntereses" minOccurs="0"/>
      <xs:element name="idiomas" type="TipoIdiomas" minOccurs="0"/>
    </xs:sequence>
  </xs:complexType>

  <xs:complexType name="TipoCabeceraPagina">
    <xs:sequence>
      <xs:element name="titulo" type="xs:string"/>
      <xs:element name="subtitulo" type="xs:string"/>
    </xs:sequence>
  </xs:complexType>

  <xs:complexType name="TipoTrayectoria">
    <xs:sequence>
      <xs:element name="titulo" type="xs:string" default="Trayectoria e intereses"/>
      <xs:element name="parrafo" type="xs:string" maxOccurs="unbounded"/>
    </xs:sequence>
  </xs:complexType>

  <xs:complexType name="TipoDatosPersonalesTabla">
    <xs:sequence>
      <xs:element name="titulo-tabla" type="xs:string" default="Datos personales"/>
      <xs:element name="dato" maxOccurs="unbounded">
        <xs:complexType>
          <xs:simpleContent>
            <xs:extension base="xs:string">
              <xs:attribute name="etiqueta" type="xs:string" use="required"/>
              <xs:attribute name="enlace" type="xs:string" use="optional"/>
            </xs:extension>
          </xs:simpleContent>
        </xs:complexType>
      </xs:element>
    </xs:sequence>
  </xs:complexType>

  <xs:complexType name="TipoIntereses">
    <xs:sequence>
      <xs:element name="titulo" type="xs:string" default="Intereses y Aficiones"/>
      <xs:element name="interes" type="TipoInteres" maxOccurs="unbounded"/>
    </xs:sequence>
  </xs:complexType>

  <xs:complexType name="TipoInteres">
    <xs:sequence>
      <xs:element name="titulo" type="xs:string"/>
      <xs:element name="descripcion" type="xs:string"/>
      <xs:element name="imagen" type="TipoImagen" minOccurs="0"/>
    </xs:sequence>
  </xs:complexType>

  <xs:complexType name="TipoIdiomas">
    <xs:sequence>
      <xs:element name="idioma-item" maxOccurs="unbounded">
        <xs:complexType>
          <xs:attribute name="nombre" type="xs:string" use="required"/>
          <xs:attribute name="nivel" type="xs:string" use="required"/>
          <xs:attribute name="porcentaje" type="TipoPorcentaje" use="optional"/>
        </xs:complexType>
      </xs:element>
    </xs:sequence>
  </xs:complexType>

  <!-- ======================================================== -->
  <!-- 3. PÁGINA DE PROYECTOS                                   -->
  <!-- ======================================================== -->

  <xs:complexType name="TipoPaginaProyectos">
    <xs:sequence>
      <xs:element name="cabecera" type="TipoCabeceraPagina"/>
      <xs:element name="categorias-filtro" type="TipoCategoriasFiltro"/>
      <xs:element name="lista-proyectos" type="TipoListaProyectos"/>
    </xs:sequence>
  </xs:complexType>

  <xs:complexType name="TipoCategoriasFiltro">
    <xs:sequence>
      <xs:element name="categoria" maxOccurs="unbounded">
        <xs:complexType>
          <xs:attribute name="id" type="xs:string" use="required"/>
          <xs:attribute name="etiqueta" type="xs:string" use="required"/>
        </xs:complexType>
      </xs:element>
    </xs:sequence>
  </xs:complexType>

  <xs:complexType name="TipoListaProyectos">
    <xs:sequence>
      <xs:element name="proyecto" type="TipoProyecto" maxOccurs="unbounded"/>
    </xs:sequence>
  </xs:complexType>

  <xs:complexType name="TipoProyecto">
    <xs:sequence>
      <xs:element name="etiqueta-destacada" type="xs:string" minOccurs="0"/>
      <xs:element name="titulo" type="xs:string"/>
      <xs:element name="descripcion" type="xs:string"/>
      <xs:element name="imagen" type="TipoImagen" minOccurs="0"/>
      <xs:element name="tecnologias" type="TipoTagsTecnologias"/>
      <xs:element name="enlaces" type="TipoEnlacesProyecto" minOccurs="0"/>
    </xs:sequence>
    <xs:attribute name="categoria" type="xs:string" use="required"/>
    <xs:attribute name="estado" type="TipoEstadoProyecto" default="completado"/>
    <xs:attribute name="destacado" type="xs:boolean" default="false"/>
  </xs:complexType>

  <xs:complexType name="TipoTagsTecnologias">
    <xs:sequence>
      <xs:element name="tag" type="xs:string" maxOccurs="unbounded"/>
    </xs:sequence>
  </xs:complexType>

  <xs:complexType name="TipoEnlacesProyecto">
    <xs:sequence>
      <xs:element name="enlace" maxOccurs="unbounded">
        <xs:complexType>
          <xs:attribute name="tipo" type="xs:string" use="required"/>
          <xs:attribute name="url" type="xs:anyURI" use="required"/>
          <xs:attribute name="texto" type="xs:string" use="required"/>
        </xs:complexType>
      </xs:element>
    </xs:sequence>
  </xs:complexType>

  <!-- ======================================================== -->
  <!-- 4. PÁGINA DE CURRÍCULUM                                  -->
  <!-- ======================================================== -->

  <xs:complexType name="TipoPaginaCurriculum">
    <xs:sequence>
      <xs:element name="cabecera">
        <xs:complexType>
          <xs:complexContent>
            <xs:extension base="TipoCabeceraPagina">
              <xs:sequence>
                <xs:element name="descarga-pdf" minOccurs="0">
                  <xs:complexType>
                    <xs:attribute name="url" type="xs:string" use="required"/>
                    <xs:attribute name="texto" type="xs:string" default="Descargar PDF"/>
                  </xs:complexType>
                </xs:element>
              </xs:sequence>
            </xs:extension>
          </xs:complexContent>
        </xs:complexType>
      </xs:element>
      <xs:choice maxOccurs="unbounded">
        <xs:element name="experiencia-laboral" type="TipoExperienciaLaboral"/>
        <xs:element name="formacion-academica" type="TipoFormacionAcademica"/>
        <xs:element name="competencias" type="TipoCompetencias"/>
      </xs:choice>
    </xs:sequence>
  </xs:complexType>

  <xs:complexType name="TipoExperienciaLaboral">
    <xs:sequence>
      <xs:element name="puesto" type="TipoPuesto" maxOccurs="unbounded"/>
    </xs:sequence>
  </xs:complexType>

  <xs:complexType name="TipoPuesto">
    <xs:sequence>
      <xs:element name="cargo" type="xs:string"/>
      <xs:element name="empresa" type="xs:string"/>
      <xs:element name="periodo" type="TipoPeriodo"/>
      <xs:element name="descripcion" type="xs:string"/>
      <xs:element name="logros" minOccurs="0">
        <xs:complexType>
          <xs:sequence>
            <xs:element name="logro" type="xs:string" maxOccurs="unbounded"/>
          </xs:sequence>
        </xs:complexType>
      </xs:element>
      <xs:element name="tecnologias" type="TipoTagsTecnologias" minOccurs="0"/>
    </xs:sequence>
  </xs:complexType>

  <xs:complexType name="TipoPeriodo">
    <xs:attribute name="inicio" type="xs:string" use="required"/>
    <xs:attribute name="fin" type="xs:string" default="Actualidad"/>
  </xs:complexType>

  <xs:complexType name="TipoFormacionAcademica">
    <xs:sequence>
      <xs:element name="estudio" type="TipoEstudio" maxOccurs="unbounded"/>
    </xs:sequence>
  </xs:complexType>

  <xs:complexType name="TipoEstudio">
    <xs:sequence>
      <xs:element name="titulo" type="xs:string"/>
      <xs:element name="institucion" type="xs:string"/>
      <xs:element name="periodo" type="TipoPeriodo"/>
      <xs:element name="descripcion" type="xs:string" minOccurs="0"/>
    </xs:sequence>
  </xs:complexType>

  <xs:complexType name="TipoCompetencias">
    <xs:sequence>
      <xs:element name="grupo" maxOccurs="unbounded">
        <xs:complexType>
          <xs:sequence>
            <xs:element name="item" maxOccurs="unbounded">
              <xs:complexType>
                <xs:attribute name="nombre" type="xs:string" use="required"/>
                <xs:attribute name="nivel" type="TipoNivelCompetencia" use="optional"/>
              </xs:complexType>
            </xs:element>
          </xs:sequence>
          <xs:attribute name="nombre" type="xs:string" use="required"/>
        </xs:complexType>
      </xs:element>
    </xs:sequence>
  </xs:complexType>

  <!-- ======================================================== -->
  <!-- 5. PÁGINA DE CONTACTO                                    -->
  <!-- ======================================================== -->

  <xs:complexType name="TipoPaginaContacto">
    <xs:sequence>
      <xs:element name="cabecera" type="TipoCabeceraPagina"/>
      <xs:element name="canales" type="TipoCanalesContacto"/>
      <xs:element name="disponibilidad" type="TipoDisponibilidad" minOccurs="0"/>
      <xs:element name="formulario" type="TipoFormularioContacto" minOccurs="0"/>
    </xs:sequence>
  </xs:complexType>

  <xs:complexType name="TipoCanalesContacto">
    <xs:sequence>
      <xs:element name="canal" maxOccurs="unbounded">
        <xs:complexType>
          <xs:attribute name="tipo" type="xs:string" use="required"/>
          <xs:attribute name="etiqueta" type="xs:string" use="required"/>
          <xs:attribute name="valor" type="xs:string" use="required"/>
          <xs:attribute name="href" type="xs:string" use="required"/>
        </xs:complexType>
      </xs:element>
    </xs:sequence>
  </xs:complexType>

  <xs:complexType name="TipoDisponibilidad">
    <xs:sequence>
      <xs:element name="estado" type="xs:string"/>
      <xs:element name="descripcion" type="xs:string"/>
    </xs:sequence>
  </xs:complexType>

  <xs:complexType name="TipoFormularioContacto">
    <xs:sequence>
      <xs:element name="titulo" type="xs:string" default="Envíame un mensaje"/>
      <xs:element name="descripcion" type="xs:string" minOccurs="0"/>
    </xs:sequence>
  </xs:complexType>

</xs:schema>
